{
  "exercise": "One-Arm Kettlebell Jerk",
  "states": {
    "start": {
      "angles": {
        "shoulder_left": 21.85,
        "shoulder_right": 80.61,
        "elbow_left": 130.52,
        "elbow_right": 131.64,
        "wrist_left": 163.62,
        "wrist_right": 171.15,
        "neck_left": 124.65,
        "neck_right": 122.22,
        "torso_left": 170.87,
        "torso_right": 166.11,
        "hip_left": 170.87,
        "hip_right": 166.11,
        "knee_left": 150.95,
        "knee_right": 139.74,
        "ankle_left": 65.08,
        "ankle_right": 69.37
      },
      "ratios": {
        "forearm_upperarm_left": 1.335,
        "forearm_upperarm_right": 1.76,
        "shin_thigh_left": 1.432,
        "shin_thigh_right": 1.435
      },
      "orientation": {
        "torso_tilt_deg": 13.67,
        "hip_shoulder_alignment_deg": 1.56
      },
      "landmarks": {
        "ordered_names": [
          "nose",
          "left_eye_inner",
          "left_eye",
          "left_eye_outer",
          "right_eye_inner",
          "right_eye",
          "right_eye_outer",
          "left_ear",
          "right_ear",
          "mouth_left",
          "mouth_right",
          "left_shoulder",
          "right_shoulder",
          "left_elbow",
          "right_elbow",
          "left_wrist",
          "right_wrist",
          "left_pinky",
          "right_pinky",
          "left_index",
          "right_index",
          "left_thumb",
          "right_thumb",
          "left_hip",
          "right_hip",
          "left_knee",
          "right_knee",
          "left_ankle",
          "right_ankle",
          "left_heel",
          "right_heel",
          "left_foot_index",
          "right_foot_index"
        ],
        "points": [
          {
            "x": 0.5019992589950562,
            "y": 0.3084300756454468,
            "z": -0.2435227334499359,
            "visibility": 0.9999908208847046
          },
          {
            "x": 0.5049794316291809,
            "y": 0.297174334526062,
            "z": -0.22464723885059357,
            "visibility": 0.9999681711196899
          },
          {
            "x": 0.5076612234115601,
            "y": 0.29744866490364075,
            "z": -0.2246159166097641,
            "visibility": 0.9999644756317139
          },
          {
            "x": 0.5103562474250793,
            "y": 0.2980947494506836,
            "z": -0.22456201910972595,
            "visibility": 0.9999618530273438
          },
          {
            "x": 0.49581587314605713,
            "y": 0.29828399419784546,
            "z": -0.22227884829044342,
            "visibility": 0.9999618530273438
          },
          {
            "x": 0.49245262145996094,
            "y": 0.29931870102882385,
            "z": -0.22232262790203094,
            "visibility": 0.999961256980896
          },
          {
            "x": 0.48947837948799133,
            "y": 0.3002902567386627,
            "z": -0.22228124737739563,
            "visibility": 0.9999594688415527
          },
          {
            "x": 0.5144962072372437,
            "y": 0.306765615940094,
            "z": -0.11700576543807983,
            "visibility": 0.999944806098938
          },
          {
            "x": 0.4833512604236603,
            "y": 0.31031179428100586,
            "z": -0.10812588781118393,
            "visibility": 0.9998831748962402
          },
          {
            "x": 0.507301390171051,
            "y": 0.3248348832130432,
            "z": -0.20473092794418335,
            "visibility": 0.9999759197235107
          },
          {
            "x": 0.4962330758571625,
            "y": 0.3246476948261261,
            "z": -0.20233801007270813,
            "visibility": 0.999964714050293
          },
          {
            "x": 0.5490801334381104,
            "y": 0.38927721977233887,
            "z": -0.05505910888314247,
            "visibility": 0.9999676942825317
          },
          {
            "x": 0.4602717161178589,
            "y": 0.3857392370700836,
            "z": -0.041954975575208664,
            "visibility": 0.9998410940170288
          },
          {
            "x": 0.5722479224205017,
            "y": 0.4740910530090332,
            "z": -0.04277706518769264,
            "visibility": 0.9988375306129456
          },
          {
            "x": 0.42605456709861755,
            "y": 0.43732309341430664,
            "z": -0.1592392921447754,
            "visibility": 0.9975918531417847
          },
          {
            "x": 0.5965651869773865,
            "y": 0.5594130754470825,
            "z": -0.12134386599063873,
            "visibility": 0.9984455704689026
          },
          {
            "x": 0.4328754246234894,
            "y": 0.3493154048919678,
            "z": -0.3753140866756439,
            "visibility": 0.9981620907783508
          },
          {
            "x": 0.605242133140564,
            "y": 0.5908541679382324,
            "z": -0.14170649647712708,
            "visibility": 0.9929890632629395
          },
          {
            "x": 0.4362592399120331,
            "y": 0.33232370018959045,
            "z": -0.4242347478866577,
            "visibility": 0.9925426244735718
          },
          {
            "x": 0.5993362665176392,
            "y": 0.5926342010498047,
            "z": -0.17120209336280823,
            "visibility": 0.993521511554718
          },
          {
            "x": 0.4416871666908264,
            "y": 0.3293389081954956,
            "z": -0.4196278154850006,
            "visibility": 0.9919695258140564
          },
          {
            "x": 0.5949186682701111,
            "y": 0.5838018655776978,
            "z": -0.13433808088302612,
            "visibility": 0.991631805896759
          },
          {
            "x": 0.4422936737537384,
            "y": 0.3357420563697815,
            "z": -0.3807973563671112,
            "visibility": 0.988324761390686
          },
          {
            "x": 0.5281616449356079,
            "y": 0.5868044495582581,
            "z": -0.004456452559679747,
            "visibility": 0.9998304843902588
          },
          {
            "x": 0.47458186745643616,
            "y": 0.5874834060668945,
            "z": 0.004315918777137995,
            "visibility": 0.9998759031295776
          },
          {
            "x": 0.5342410802841187,
            "y": 0.7202789187431335,
            "z": 0.03914240375161171,
            "visibility": 0.997026264667511
          },
          {
            "x": 0.45986050367355347,
            "y": 0.7225170731544495,
            "z": 0.012444410473108292,
            "visibility": 0.998177170753479
          },
          {
            "x": 0.5520482659339905,
            "y": 0.8567594885826111,
            "z": 0.18595904111862183,
            "visibility": 0.9964776635169983
          },
          {
            "x": 0.45191994309425354,
            "y": 0.8637049198150635,
            "z": 0.14708411693572998,
            "visibility": 0.9979603290557861
          },
          {
            "x": 0.5498285889625549,
            "y": 0.876243531703949,
            "z": 0.19279871881008148,
            "visibility": 0.943215548992157
          },
          {
            "x": 0.45683804154396057,
            "y": 0.8819490671157837,
            "z": 0.15327976644039154,
            "visibility": 0.9495547413825989
          },
          {
            "x": 0.560645341873169,
            "y": 0.9035349488258362,
            "z": 0.06793688237667084,
            "visibility": 0.9947023987770081
          },
          {
            "x": 0.44225913286209106,
            "y": 0.9125170707702637,
            "z": 0.030586881563067436,
            "visibility": 0.9963864088058472
          }
        ]
      }
    },
    "end": {
      "angles": {
        "shoulder_left": 38.15,
        "shoulder_right": 87.87,
        "elbow_left": 137.46,
        "elbow_right": 123.18,
        "wrist_left": 170.52,
        "wrist_right": 170.19,
        "neck_left": 140.77,
        "neck_right": 138.32,
        "torso_left": 119.14,
        "torso_right": 109.87,
        "hip_left": 119.14,
        "hip_right": 109.87,
        "knee_left": 90.75,
        "knee_right": 84.05,
        "ankle_left": 48.92,
        "ankle_right": 58.02
      },
      "ratios": {
        "forearm_upperarm_left": 1.375,
        "forearm_upperarm_right": 1.697,
        "shin_thigh_left": 1.851,
        "shin_thigh_right": 1.478
      },
      "orientation": {
        "torso_tilt_deg": 31.07,
        "hip_shoulder_alignment_deg": 2.87
      },
      "landmarks": {
        "ordered_names": [
          "nose",
          "left_eye_inner",
          "left_eye",
          "left_eye_outer",
          "right_eye_inner",
          "right_eye",
          "right_eye_outer",
          "left_ear",
          "right_ear",
          "mouth_left",
          "mouth_right",
          "left_shoulder",
          "right_shoulder",
          "left_elbow",
          "right_elbow",
          "left_wrist",
          "right_wrist",
          "left_pinky",
          "right_pinky",
          "left_index",
          "right_index",
          "left_thumb",
          "right_thumb",
          "left_hip",
          "right_hip",
          "left_knee",
          "right_knee",
          "left_ankle",
          "right_ankle",
          "left_heel",
          "right_heel",
          "left_foot_index",
          "right_foot_index"
        ],
        "points": [
          {
            "x": 0.5090079307556152,
            "y": 0.3846975266933441,
            "z": -0.29854580760002136,
            "visibility": 0.9999591112136841
          },
          {
            "x": 0.5138994455337524,
            "y": 0.37136703729629517,
            "z": -0.2829224765300751,
            "visibility": 0.9998313188552856
          },
          {
            "x": 0.5167646408081055,
            "y": 0.37155434489250183,